{
  "name":"projects/demo-project/locations/global/catalogs/default_catalog/branches/0/products/SKU-1001",
  "id":"SKU-1001",
  "type":"PRIMARY",
  "gtin":"00012345600012",
  "categories":[
    "Shoes > Running > Men's Running Shoes"
  ],
  "title":"Nike Air Zoom Pegasus 41",
  "brands":[
    "Nike"
  ],
  "description":"Lightweight men's running shoes with responsive foam cushioning and breathable mesh upper.",
  "languageCode":"en-US",
  "attributes":{
    "style":{
      "text":[
        "running"
      ],
      "numbers":[

      ],
      "searchable":true,
      "indexable":true
    },
    "drop_mm":{
      "text":[

      ],
      "numbers":[
        10
      ],
      "searchable":false,
      "indexable":true
    },
    "terrain":{
      "text":[
        "road"
      ],
      "numbers":[

      ],
      "searchable":true,
      "indexable":true
    }
  },
  "tags":[
    "best-seller",
    "new-arrival",
    "summer-2026"
  ],
  "priceInfo":{
    "currencyCode":"USD",
    "price":139.99,
    "originalPrice":159.99,
    "cost":82.5,
    "priceEffectiveTime":"2026-05-01T00:00:00Z",
    "priceExpireTime":"2026-06-01T00:00:00Z",
    "priceRange":{
      "price":139.99,
      "originalPrice":159.99
    }
  },
  "rating":{
    "ratingCount":842,
    "averageRating":4.7,
    "ratingHistogram":[
      12,
      18,
      44,
      173,
      595
    ]
  },
  "availableTime":"2026-04-15T00:00:00Z",
  "availability":"IN_STOCK",
  "availableQuantity":48,
  "fulfillmentInfo":[
    {
      "type":"pickup-in-store",
      "placeIds":[
        "store-001",
        "store-002"
      ]
    },
    {
      "type":"same-day-delivery",
      "placeIds":[
        "warehouse-east"
      ]
    }
  ],
  "uri":"https://store.example.com/products/nike-air-zoom-pegasus-41",
  "images":[
    {
      "uri":"https://cdn.example.com/images/pegasus41-main.jpg",
      "height":1200,
      "width":1200
    },
    {
      "uri":"https://cdn.example.com/images/pegasus41-side.jpg",
      "height":1200,
      "width":1200
    }
  ],
  "audience":{
    "genders":[
      "male"
    ],
    "ageGroups":[
      "adult"
    ]
  },
  "colorInfo":{
    "colorFamilies":[
      "Blue"
    ],
    "colors":[
      "Navy Blue",
      "White"
    ]
  },
  "sizes":[
    "9",
    "10",
    "11"
  ],
  "materials":[
    "Mesh",
    "Rubber"
  ],
  "patterns":[
    "Solid"
  ],
  "conditions":[
    "new"
  ],
  "promotions":[
    {
      "promotionId":"SUMMER_RUN_2026"
    }
  ],
  "publishTime":"2026-04-10T12:00:00Z",
  "retrievableFields":"title,brands,priceInfo,images",
  "variants":[
    {
      "id":"SKU-1001-BLUE-10",
      "type":"VARIANT",
      "primaryProductId":"SKU-1001",
      "colorInfo":{
        "colorFamilies":[
          "Blue"
        ],
        "colors":[
          "Navy Blue"
        ]
      },
      "sizes":[
        "10"
      ],
      "availability":"IN_STOCK",
      "priceInfo":{
        "currencyCode":"USD",
        "price":139.99
      }
    }
  ],
  "localInventories":[
    {
      "placeId":"store-001",
      "priceInfo":{
        "currencyCode":"USD",
        "price":139.99
      },
      "attributes":{
        "pickup_time_hours":{
          "text":[

          ],
          "numbers":[
            2
          ],
          "searchable":false,
          "indexable":false
        }
      },
      "fulfillmentTypes":[
        "pickup-in-store"
      ],
      "availability":"IN_STOCK"
    }
  ],
  "ttl":"2592000s"
}